{
  "$schema": "https://json-schema.org/draft/2020-12/schema",
  "$id": "https://traceknot.kyungho.info/schemas/verification-run.v1.json",
  "title": "Canonical verification run",
  "type": "object",
  "additionalProperties": false,
  "required": ["schemaVersion", "runId", "requestId", "rootIdentity", "snapshotId", "state", "observationIds", "claimIds", "evaluationIds", "revision", "createdAt", "updatedAt"],
  "properties": {
    "schemaVersion": { "const": "verification-run/v1" },
    "runId": { "type": "string", "minLength": 1 },
    "requestId": { "type": "string", "minLength": 1 },
    "rootIdentity": { "type": "string", "minLength": 1 },
    "snapshotId": { "type": "string", "minLength": 1 },
    "state": { "enum": ["CREATED", "BASIS_ESTABLISHED", "DISCOVERY_COMPLETED", "PLANNED", "EXECUTING", "EVIDENCE_EVALUATED", "VERDICT_RESOLVED", "TERMINAL"] },
    "observationIds": {
      "type": "array",
      "uniqueItems": true,
      "items": { "type": "string", "minLength": 1 }
    },
    "claimIds": {
      "type": "array",
      "uniqueItems": true,
      "items": { "type": "string", "minLength": 1 }
    },
    "evaluationIds": {
      "type": "array",
      "uniqueItems": true,
      "items": { "type": "string", "minLength": 1 }
    },
    "revision": { "type": "integer", "minimum": 0 },
    "createdAt": { "type": "string", "pattern": "^\\d{4}-\\d{2}-\\d{2}T\\d{2}:\\d{2}:\\d{2}(?:\\.\\d+)?Z$" },
    "updatedAt": { "type": "string", "pattern": "^\\d{4}-\\d{2}-\\d{2}T\\d{2}:\\d{2}:\\d{2}(?:\\.\\d+)?Z$" }
  }
}
